name,state,city,address,lattitude,longitude,type
IOCL Rajokri Station,Delhi,New Delhi,"NH 8 Exit 4, Samalka, New Delhi, Delhi 110037",28.5248,77.101,12.0
Hotel Mount View International AC Charging Station,Delhi,New Delhi,"Hount Mount View International, Jammu Rd, Vaishnodevi, Katra, Jammu and Kashmir 182301",32.9918,74.9306,12.0
Oyo Townhouse 118,Delhi,delhi,"20, Gagan Vihar, Krishna Nagar ",28.646011,77.296796,6.0
"IOCL Hundred Percent Filling & Service Station, Dwarka",Delhi,Delhi,"Sector 9, Dwarka, New Delhi, Delhi 110073",28.578641,77.05962,7.0
"IOCL - Citi Fuels, Virender Nagar",Delhi,Delhi,OPP.-VIRENDER NAGAR NEAR BHARATI COLLEGE NEW DELHI,28.622486,77.09547,7.0
"IOCL - Gay Service Station, Azadpur",Delhi,Delhi,"Near Azadpur, New Delhi,110033",28.703312,77.181109,7.0
"Pacific Mall, Tagore Garden",Delhi,Delhi,"Najafgarh Rd, Tagore Garden, Tilak Nagar, New Delhi, Delhi 110018",28.6422188,77.1058913,7.0
"IOCL - Tikri Gas, Delhi",Delhi,Delhi,"Rohtak Road, Block C, Tyagi Vihar, Ghevra, Delhi, 110072",28.6868847,76.9849286,7.0
EV Plugin Charge Vasant Square Mall,Delhi,New Delhi,"Vasant Kunj Marg, Pocket 5, Sector B, Vasant Kunj, New Delhi, Delhi 110070",28.52544024,77.15590041,8.0
EESL Malviya Nagar Delhi,Delhi,New Delhi,"Guru Gobind Singh Marg, Old Market, Block C, Malviya Nagar, New Delhi, Delhi 110017",28.53646664,77.21145062,8.0
BRPL Nehru Place,Delhi,New Delhi,"BSES Bhawan, near Kalkaji Mandir metro station, Nehru Place, New Delhi, Delhi 110019",28.5495423,77.2545699,8.0
EESL Dilli Haat,Delhi,New Delhi,"NDMC Parking, Dilli Haat, West Kidwai Nagar, New Delhi - 110023",28.57357604,77.207152,8.0
EESL Palika Maternity Hospital,Delhi,New Delhi,"Palika Maternity Hospital, block 11, Lodhi Colony, Near Khanna Market, New Delhi - 110003",28.583518,77.222057,8.0
EESL Prithviraj Market,Delhi,New Delhi,"NDMC Parking, Prithviraj Market, Prithviraj Ln, New Delhi - 110003",28.600735,77.226277,8.0
EESL KTM,Delhi,New Delhi,"NDMC Parking, Opp South Indian Bank, Block - E , RR6, Middle Circle, connaught Place, New Delhi - 110001",28.63372677,77.22193874,8.0
u00a0EESL Sushma Swaraj Bhawan,Delhi,Delhi,"Susma swaraj Bhawan, MEA, New Delhi",28.59583333,77.18055556,16.0
MG DELHI SHIVAJI MARG,Delhi NCR,NEW DELHI,PLOT NO 13 SHIVAJI MARG DELHI 110015 NEW DELHI,28.66196,77.152242,20.0
EESL Chelmsford Club,Delhi NCR,Delhi,"Outside Chelmsford Club/ Opposite CSIR Building, Rafi Marg, Sansad Marg Area, New Delhi 110001",28.61826041,77.21256986,8.0
"Westside, Lajpat Nagar",Delhi NCR,Delhi,"A-15, Alankar Cinema Building, Feroze Gandhi Marg, Lajpat Nagar III, New Delhi 110024",28.56817,77.24112,7.0
"IOCL - Sabarwal Service Station, RK Puram",Delhi NCR,Delhi,"Tamil Sangam Marg, Sector 5, Rama Krishna Puram, New Delhi-110022",28.564625,77.177461,7.0
"Sagar Motors, Dilshad Garden",Delhi NCR,Delhi,"No ZB/43 487 & ZB, 44 487, Dilshad Garden, New Delhi, Delhi 110095",28.676246,77.31768,7.0
IOCL Risal Petro Delhi,Delhi NCR,Delhi,"Burari Rd, opposite Sta Tpt Authority, Laldora, Jharoda, Jharoda Majra Burari, New Delhi, Delhi 110084",28.7324265,77.1986248,7.0
IOCL Bedi Saxena Delhi,Delhi NCR,Delhi,"B-88-5, 86-5, Sat Guru Ram Singh Rd, Block B, Mayapuri Industrial Area Phase I, Mayapuri, New Delhi, Delhi 110064",28.627092,77.121841,7.0
"Pacific Mall,  Dwarka",Delhi NCR,Delhi,"Dwarka sector 21 metro station, PACIFIC MALL, Sector 22 Rd, Sector 21, Dwarka, New Delhi, Delhi 110077",28.5512199,77.056702,7.0
"HPCL - Delhi Punjab Fuel Station, Singhu Border",Delhi NCR,Delhi,"15/1 Gt.karnal RD. Singhu Border, Po, Narela, Delhi, 110040",28.8558802,77.1245004,7.0
IOCL - AAUI Service Station ,Delhi NCR,Delhi,IOCL at Plot No 1 I P Estate Ring Road New Delhi-110002,28.6179662,77.2487894,7.0
"Worldmark 2, Aerocity",Delhi NCR,Delhi,"Worldmark Aerocity, New Delhi  - 110037",28.5494799,77.1213702,7.0
"Pacific Mall, Netaji Subash Palace",Delhi NCR,Delhi,"Pitam Pura, New Delhi, Delhi 110034",28.6933409,77.1531325,7.0
"HPCL - Badarpur Service Station, Gazipur",Delhi NCR,Delhi,"Integrated Freight Complex, Mayur Vihar Phase III, Gharoli, Delhi, Uttar Pradesh 110096",28.6197025,77.3411839,7.0
Tata Power ,Delhi,Delhi,"Ssensse Hotel, Sec 25, PLOT NO.28, POCKET 5A, SECTOR 25, ROHINI NEW Delhi 110085",28.735847,77.093263,7.0
