name,state,city,address,lattitude,longitude,type
Hotel Dolphin AC Charging Station,Delhi,New Delhi,"Hotel Dolphin, Railway Rd, Katra, Jammu and Kashmir 182301",32.9892,74.9289,12.0
IOCL Paul Motors Delhi,Delhi,Delhi,"Main Road, Sat Guru Ram Singh Rd, MS Block, Block F, Mayapuri Industrial Area Phase II, Mayapuri, New Delhi, Delhi 110064",28.61986668,77.11398244,7.0
EESL PSOI Club,Delhi,New Delhi,"PSOI Club Chanakyapuri, New Delhi, Delhi 110021",28.58664525,77.19360781,8.0
EESL Van Heusen,Delhi,New Delhi,"Ground & Mazanine Floor, Rajiv Chowk, Block A, Connaught Place, New Delhi, Delhi 110001",28.63296432,77.21796241,8.0
MG DELHI LAJPAT NAGAR,Delhi NCR,NEW DELHI,"A-14, Ring Road, Lajpat nagar, Delhi 110024",28.564863,77.236743,20.0
"Sagar Motors, Dilshad Garden",Delhi NCR,Delhi,"No ZB/43 487 & ZB, 44 487, Dilshad Garden, New Delhi, Delhi 110095",28.676246,77.31768,7.0
"Worldmark 2, Aerocity",Delhi NCR,Delhi,"Worldmark Aerocity, New Delhi  - 110037",28.5494799,77.1213702,7.0
"Pacific Mall, Netaji Subash Palace",Delhi NCR,Delhi,"Pitam Pura, New Delhi, Delhi 110034",28.6933409,77.1531325,7.0
"HPCL - Badarpur Service Station, Gazipur",Delhi NCR,Delhi,"Integrated Freight Complex, Mayur Vihar Phase III, Gharoli, Delhi, Uttar Pradesh 110096",28.6197025,77.3411839,7.0
Tata Power ,Delhi,Delhi,"Ssensse Hotel, Sec 25, PLOT NO.28, POCKET 5A, SECTOR 25, ROHINI NEW Delhi 110085",28.735847,77.093263,7.0
